{
  "title": "Duomenų analizės kelio atmintinė (moduliai 7–9)",
  "subtitle": "Pipeline, MASTER PROMPTAS ir 8 žingsnių projektas – atsispausdink arba laikyk prie darbo.",
  "pipelineSteps": [
    "Duomenų rinkimas – įvardyk šaltinius, temą ir kontekstą.",
    "Duomenų paruošimas – sutvarkyk formatą, trūkstamas reikšmes ir dublius.",
    "Tiriamoji analizė (EDA) – pažiūrėk, kas kartojasi, kas išsiskiria ir ką verta tikrinti.",
    "Modeliai ir metodai – pasirink analizės būdą pagal klausimą.",
    "Vizualizacija – parink grafikus ir rodiklius, kuriuos supras vadovas.",
    "Publikavimas – paversk įžvalgas aiškia ataskaita arba sprendimu."
  ],
  "masterPromptSteps": [
    "Duomenų šaltiniai – nurodyk, iš kur ateina informacija.",
    "Duomenų struktūra – aprašyk lenteles, laukus arba dokumentus.",
    "Valymas – pašalink dublius, suvienodink formatus, pažymėk spragas.",
    "Tiriamoji analizė (EDA) – paprašyk dėsningumų, anomalijų ir hipotezių.",
    "Vizualizacijos – paprašyk grafikų idėjų ir ką kiekvienas turi parodyti.",
    "Įžvalgos – išskirk, ką tai reiškia verslui ar komandai.",
    "Prognozės – įvardyk galimus scenarijus ir rizikas.",
    "Rekomendacijos – paprašyk 3–5 konkrečių veiksmų."
  ],
  "workflowSteps": [
    "Surink duomenų šaltinius apie įmonę, sektorių arba klausimą.",
    "Paruošk metodikos promptą: ką analizuoti, kokius rodiklius naudoti.",
    "Paruošk gilaus tyrimo promptą, tinkamą keliems DI įrankiams.",
    "Paleisk tą patį tyrimą 2–4 DI įrankiuose ir išsaugok išvestis.",
    "Išvalyk rezultatus: pašalink dublius, suvienodink datas ir skaičius.",
    "Sujunk rezultatus į vieną struktūruotą dokumentą.",
    "Paprašyk vizualizacijos specifikacijos: grafikai, spalvos, rodikliai.",
    "Sugeneruok paprastą dashboard arba aiškią vadovybės santrauką."
  ],
  "starterPrompt": "META: Tu esi mano duomenų analizės asistentas. Tikslas – per vieną ciklą paruošti aiškią vadovybės santrauką.\nINPUT: Tema: [įrašyk]. Šaltiniai: [nuorodos / failai / pastabos]. Apribojimai: [laikas, konfidencialumas].\nOUTPUT: (1) 5 punktų EDA santrauka, (2) 3 įžvalgos su rizikos žyma, (3) 3 rekomendacijos su pirmu veiksmu.\nQUALITY: Jei trūksta duomenų – rašyk „nežinau“ ir nurodyk, ko reikia. Necituok neegzistuojančių šaltinių.",
  "reflectionSummary": "Pakartok 8 žingsnius su kita tema. Atsakyk sau: ką padarei, ką tai reiškia tavo darbui ir koks vienas kitas veiksmas?",
  "nextPageHeading": "Kitas žingsnis",
  "nextPageIntro": "Vienas workflow ciklas = vienas paruoštas projektas. Toliau gilink šabloną arba pasirink kitą žingsnį Promptų anatomijos ekosistemoje.",
  "primaryCtaLabel": "Workflow canvas šablonas (blog)",
  "secondaryCtaLabels": {
    "decide": "Nuspręsk kitą žingsnį (Decide)",
    "map": "Peržiūrėk ekosistemos žemėlapį (Map)"
  },
  "websiteUrl": "https://www.promptanatomy.app/",
  "websiteCta": "Kursas ir daugiau: promptanatomy.app",
  "footerText": "Promptų anatomija – promptų struktūros mokymas. © Kurso medžiaga."
}
